{"automationEvidence":null,"buildId":"unbuilt-source-a81a79e-fix1","claims":{"automationPassed":false,"controllerPassed":false,"defectGatePassed":false,"fourRoutesPassed":false,"onboardingPassed":false,"releaseCandidateReady":false,"saveRegressionPassed":false,"task27Passed":false},"commands":{"releaseAutomation":{"command":["UnrealEditor-Cmd","DominionAscendant.uproject","-unattended","-nop4","-nullrhi","-ExecCmds=Automation RunTests Dominion.Release;Quit","-TestExit=Automation Test Queue Empty","-DAReleaseFixturePlan=Intermediate/Release/VerticalSliceRouteFixture.plan.json","-DAReleaseAutomationEvidence=Intermediate/Release/Task28ReleaseAutomationEvidence.json","-DAReleaseRunId=task28-local-no-ue-20260826-fix1","-DAReleaseBuildId=unbuilt-source-a81a79e-fix1"],"exitCode":127,"log":{"path":"Build/Release/Task28ReleaseAutomation.exit127.log","sha256":"d0143691b707b3e60f2ae7a30ec3afd958ad4d88bd93b1a7706c98f8fc59359f"}}},"controllerEvidence":null,"defectEvidence":null,"fixturePlanEvidence":{"path":"Build/Release/Task28FixturePlan.json","sha256":"7d561fddc80b3bc4afc0235447b4187f090889106cd94aac3bb87af416ca1828"},"notReadyReasons":["Dominion.Release Automation did not complete successfully (exit 127).","No route, save, controller, onboarding, or defect evidence was inferred from the failed command."],"onboardingEvidence":null,"routeEvidence":null,"runId":"task28-local-no-ue-20260826-fix1","saveCheckpointEvidence":null,"schemaVersion":1,"state":"NOT_READY","task27Evidence":"Build/Performance/Task27PerformanceEvidence.json","task27EvidenceSha256":"5dd30298eae0244213b0aabdf7a2aabbfde52ffa9e2ec18b5460377d013ac705","task27PerformanceState":"NOT_READY"}
